{
  "$schema": "../jwtcheck/config-schema.json",
  "name": "header-auth-remediated",
  "base_url": "http://127.0.0.1:5002",
  "login": {
    "path": "/login",
    "credentials": { "username": "alice", "password": "password123" },
    "impersonate": { "username": "idswap", "password": "idswap123" },
    "token_from": { "source": "json", "field": "token" }
  },
  "send_token": { "via": "header", "name": "Authorization", "prefix": "Bearer " },
  "endpoints": { "user": "/me", "admin": "/admin" },
  "claims": { "subject": "sub", "role": "role", "admin_value": "admin" }
}
