{
  "$schema": "../jwtcheck/config-schema.json",
  "name": "cookie-auth-vulnerable",
  "base_url": "http://127.0.0.1:5006",
  "login": {
    "path": "/login",
    "credentials": { "username": "alice", "password": "password123" },
    "impersonate": { "username": "idswap", "password": "idswap123" },
    "token_from": { "source": "cookie", "name": "session" }
  },
  "send_token": { "via": "cookie", "name": "session" },
  "endpoints": { "user": "/profile", "admin": "/staff" },
  "claims": { "subject": "uid", "role": "scope", "admin_value": "admin" }
}
